{
  "$schema": "https://raw.githubusercontent.com/outpostHQ/chock/main/schema/baseline-v1.json",
  "version": 1,
  "chock": "0.10.1",
  "gates": {
    "admits": {},
    "assertions": {
      "src/cli.rs#a_project_that_has_not_run_init_gets_the_enforced_set": 1,
      "src/gates/cargo/manifest.rs#a_git_dependency_with_no_query_at_all_is_reported": 1,
      "src/gates/metrics/duplication.rs#the_series_gives_every_member_of_a_family_how_many_others_share_its_body": 1,
      "src/gates/repo/commits.rs#a_trailer_crediting_a_tool_is_reported_whatever_its_case": 1,
      "src/gates/source/mod.rs#a_builder_call_reached_through_a_longer_chain_is_still_the_same_builder": 1,
      "src/gates/source/mod.rs#a_cfg_that_still_builds_outside_a_test_run_is_not_a_test_gate": 1,
      "src/gates/source/mod.rs#a_comment_between_two_allows_does_not_break_the_stack": 1,
      "src/gates/source/mod.rs#a_corpus_file_the_parser_rejects_does_not_stop_the_gate_reading_the_crate": 1,
      "src/gates/source/mod.rs#a_multi_byte_character_above_an_attribute_moves_no_offset_below_it": 1,
      "src/gates/source/mod.rs#a_shell_interpolation_inside_a_test_is_still_reported": 1,
      "src/gates/source/mod.rs#a_stack_on_a_struct_field_is_found_the_same_way_as_one_on_a_function": 1,
      "src/gates/source/mod.rs#an_imported_or_renamed_client_resolves_to_the_same_builder": 1,
      "src/gates/tools/mod.rs#a_line_of_another_shape_is_skipped_rather_than_failing_the_gate": 1,
      "src/gates/tools/mod.rs#a_rustc_shaped_span_becomes_a_navigable_finding": 1,
      "src/run/mod.rs#a_ratchet_that_grew_trips_and_points_at_the_key_that_moved": 1,
      "src/setup/init.rs#a_file_already_holding_our_content_is_left_exactly_as_it_was": 1
    },
    "bigfiles": {},
    "binsize": {
      "chock": 4100576
    },
    "binsize@macos": {
      "chock": 3021136
    },
    "binsize@windows": {
      "chock": 4911616
    },
    "boundaries": {
      "mixed_directory_foreign_files_production": 35,
      "scattered_groups_production": 2
    },
    "citations": {},
    "claims": {},
    "codeslop": {},
    "commands": {},
    "commands-build": {},
    "complexity": {},
    "coverage": {
      "src/cli.rs": 72,
      "src/edited.rs": 14,
      "src/exec/budget.rs": 3,
      "src/exec/mod.rs": 18,
      "src/gates/cargo/features.rs": 6,
      "src/gates/cargo/manifest.rs": 2,
      "src/gates/cargo/modcheck.rs": 4,
      "src/gates/cargo/profile.rs": 17,
      "src/gates/cargo/supply.rs": 0,
      "src/gates/coverage/crap.rs": 22,
      "src/gates/coverage/mod.rs": 31,
      "src/gates/metrics/assertions.rs": 3,
      "src/gates/metrics/bigfiles.rs": 1,
      "src/gates/metrics/complexity.rs": 4,
      "src/gates/metrics/dead.rs": 4,
      "src/gates/metrics/duplication.rs": 31,
      "src/gates/metrics/nesting.rs": 9,
      "src/gates/metrics/prodlines.rs": 8,
      "src/gates/metrics/unsafety.rs": 0,
      "src/gates/mutation/survivors.rs": 0,
      "src/gates/outpost/boundaries.rs": 3,
      "src/gates/outpost/duplicates.rs": 3,
      "src/gates/outpost/intel.rs": 17,
      "src/gates/outpost/measures.rs": 3,
      "src/gates/outpost/mod.rs": 10,
      "src/gates/outpost/padding.rs": 3,
      "src/gates/outpost/scan.rs": 5,
      "src/gates/repo/commits.rs": 9,
      "src/gates/repo/history.rs": 19,
      "src/gates/repo/hygiene.rs": 2,
      "src/gates/source/interpolation.rs": 2,
      "src/gates/source/mod.rs": 19,
      "src/gates/source/shipped.rs": 0,
      "src/gates/source/testonly.rs": 4,
      "src/gates/text/citations.rs": 14,
      "src/gates/text/slop.rs": 0,
      "src/gates/tools/binsize.rs": 27,
      "src/gates/tools/codeslop.rs": 5,
      "src/gates/tools/machete.rs": 3,
      "src/gates/tools/miri.rs": 12,
      "src/gates/tools/mod.rs": 115,
      "src/gates/tools/proof.rs": 10,
      "src/gates/wiring.rs": 2,
      "src/main.rs": 0,
      "src/project/config.rs": 0,
      "src/project/document.rs": 7,
      "src/project/mod.rs": 3,
      "src/project/vcs.rs": 34,
      "src/run/baseline.rs": 0,
      "src/run/evidence.rs": 2,
      "src/run/lock.rs": 0,
      "src/run/mod.rs": 14,
      "src/run/report.rs": 1,
      "src/run/verdicts.rs": 2,
      "src/setup/agents.rs": 7,
      "src/setup/doctor.rs": 10,
      "src/setup/hooks.rs": 0,
      "src/setup/init.rs": 120,
      "src/setup/pins.rs": 1,
      "src/setup/version.rs": 1,
      "src/slop.rs": 2,
      "src/testdir.rs": 0
    },
    "coverage@macos": {
      "src/cli.rs": 38,
      "src/edited.rs": 14,
      "src/exec/budget.rs": 3,
      "src/exec/mod.rs": 31,
      "src/gates/cargo/features.rs": 4,
      "src/gates/cargo/manifest.rs": 1,
      "src/gates/cargo/modcheck.rs": 4,
      "src/gates/cargo/placement.rs": 0,
      "src/gates/cargo/profile.rs": 17,
      "src/gates/cargo/supply.rs": 0,
      "src/gates/coverage/crap.rs": 3,
      "src/gates/coverage/mod.rs": 0,
      "src/gates/declared.rs": 0,
      "src/gates/fixes.rs": 0,
      "src/gates/metrics/assertions.rs": 1,
      "src/gates/metrics/bigfiles.rs": 1,
      "src/gates/metrics/complexity.rs": 4,
      "src/gates/metrics/dead.rs": 3,
      "src/gates/metrics/duplication.rs": 31,
      "src/gates/metrics/nesting.rs": 9,
      "src/gates/metrics/prodlines.rs": 3,
      "src/gates/metrics/unsafety.rs": 0,
      "src/gates/mod.rs": 0,
      "src/gates/mutation/mutest.rs": 1,
      "src/gates/mutation/results.rs": 0,
      "src/gates/mutation/scope.rs": 0,
      "src/gates/mutation/survivors.rs": 0,
      "src/gates/mutation/targets.rs": 0,
      "src/gates/outpost/boundaries.rs": 0,
      "src/gates/outpost/duplicates.rs": 3,
      "src/gates/outpost/intel.rs": 10,
      "src/gates/outpost/measures.rs": 0,
      "src/gates/outpost/mod.rs": 5,
      "src/gates/outpost/padding.rs": 3,
      "src/gates/outpost/scan.rs": 3,
      "src/gates/repo/commits.rs": 2,
      "src/gates/repo/history.rs": 15,
      "src/gates/repo/hygiene.rs": 1,
      "src/gates/source/interpolation.rs": 2,
      "src/gates/source/mod.rs": 18,
      "src/gates/source/shipped.rs": 0,
      "src/gates/source/targets.rs": 0,
      "src/gates/source/testonly.rs": 4,
      "src/gates/text/citations.rs": 14,
      "src/gates/text/phrases.rs": 0,
      "src/gates/text/slop.rs": 0,
      "src/gates/tools/binsize.rs": 16,
      "src/gates/tools/codeslop.rs": 5,
      "src/gates/tools/doc.rs": 0,
      "src/gates/tools/dupdeps.rs": 0,
      "src/gates/tools/machete.rs": 1,
      "src/gates/tools/miri.rs": 11,
      "src/gates/tools/mod.rs": 77,
      "src/gates/tools/proof.rs": 0,
      "src/gates/wiring.rs": 2,
      "src/main.rs": 0,
      "src/project/config.rs": 0,
      "src/project/document.rs": 7,
      "src/project/mod.rs": 3,
      "src/project/vcs.rs": 34,
      "src/project/workspace.rs": 0,
      "src/run/baseline.rs": 0,
      "src/run/context.rs": 0,
      "src/run/debt.rs": 0,
      "src/run/evidence.rs": 2,
      "src/run/lock.rs": 0,
      "src/run/mod.rs": 14,
      "src/run/report.rs": 1,
      "src/run/verdicts.rs": 1,
      "src/setup/adoption.rs": 0,
      "src/setup/agents.rs": 7,
      "src/setup/doctor.rs": 3,
      "src/setup/hooks.rs": 0,
      "src/setup/init.rs": 45,
      "src/setup/pins.rs": 0,
      "src/setup/version.rs": 1,
      "src/slop.rs": 2,
      "src/testdir.rs": 0
    },
    "coverage@windows": {
      "src/cli.rs": 42,
      "src/edited.rs": 14,
      "src/exec/budget.rs": 3,
      "src/exec/mod.rs": 34,
      "src/gates/cargo/features.rs": 4,
      "src/gates/cargo/manifest.rs": 1,
      "src/gates/cargo/modcheck.rs": 4,
      "src/gates/cargo/placement.rs": 0,
      "src/gates/cargo/profile.rs": 17,
      "src/gates/cargo/supply.rs": 0,
      "src/gates/coverage/crap.rs": 22,
      "src/gates/coverage/mod.rs": 0,
      "src/gates/declared.rs": 0,
      "src/gates/fixes.rs": 0,
      "src/gates/metrics/assertions.rs": 1,
      "src/gates/metrics/bigfiles.rs": 1,
      "src/gates/metrics/complexity.rs": 4,
      "src/gates/metrics/dead.rs": 4,
      "src/gates/metrics/duplication.rs": 31,
      "src/gates/metrics/nesting.rs": 9,
      "src/gates/metrics/prodlines.rs": 3,
      "src/gates/metrics/unsafety.rs": 0,
      "src/gates/mod.rs": 0,
      "src/gates/mutation/mutest.rs": 15,
      "src/gates/mutation/results.rs": 10,
      "src/gates/mutation/scope.rs": 0,
      "src/gates/mutation/survivors.rs": 0,
      "src/gates/mutation/targets.rs": 0,
      "src/gates/outpost/boundaries.rs": 0,
      "src/gates/outpost/duplicates.rs": 3,
      "src/gates/outpost/intel.rs": 10,
      "src/gates/outpost/measures.rs": 0,
      "src/gates/outpost/mod.rs": 5,
      "src/gates/outpost/padding.rs": 3,
      "src/gates/outpost/scan.rs": 3,
      "src/gates/repo/commits.rs": 2,
      "src/gates/repo/history.rs": 15,
      "src/gates/repo/hygiene.rs": 1,
      "src/gates/source/interpolation.rs": 2,
      "src/gates/source/mod.rs": 18,
      "src/gates/source/shipped.rs": 0,
      "src/gates/source/targets.rs": 0,
      "src/gates/source/testonly.rs": 4,
      "src/gates/text/citations.rs": 14,
      "src/gates/text/phrases.rs": 2,
      "src/gates/text/slop.rs": 0,
      "src/gates/tools/binsize.rs": 30,
      "src/gates/tools/codeslop.rs": 5,
      "src/gates/tools/doc.rs": 8,
      "src/gates/tools/dupdeps.rs": 0,
      "src/gates/tools/machete.rs": 1,
      "src/gates/tools/miri.rs": 11,
      "src/gates/tools/mod.rs": 84,
      "src/gates/tools/proof.rs": 14,
      "src/gates/wiring.rs": 2,
      "src/main.rs": 0,
      "src/project/config.rs": 0,
      "src/project/document.rs": 7,
      "src/project/mod.rs": 3,
      "src/project/vcs.rs": 34,
      "src/project/workspace.rs": 0,
      "src/run/baseline.rs": 0,
      "src/run/context.rs": 0,
      "src/run/debt.rs": 0,
      "src/run/evidence.rs": 2,
      "src/run/lock.rs": 2,
      "src/run/mod.rs": 14,
      "src/run/report.rs": 1,
      "src/run/verdicts.rs": 8,
      "src/setup/adoption.rs": 0,
      "src/setup/agents.rs": 7,
      "src/setup/doctor.rs": 6,